{
 "buildingId": "fixture-office-7",
 "anchors": [
  {
   "id": "f0-a0",
   "floor": 0,
   "room": "f0-r3",
   "kind": "counter_spot",
   "position": [
    13.37,
    8.49
   ],
   "facingDeg": 180,
   "furniture": "f0-fur4"
  },
  {
   "id": "f0-a1",
   "floor": 0,
   "room": "f0-r3",
   "kind": "seat",
   "position": [
    6.39,
    8.52
   ],
   "facingDeg": 180,
   "furniture": "f0-fur5"
  },
  {
   "id": "f0-a2",
   "floor": 0,
   "room": "f0-r5",
   "kind": "toilet",
   "position": [
    19.86,
    18.89
   ],
   "facingDeg": 0,
   "furniture": "f0-fur11"
  },
  {
   "id": "f0-a3",
   "floor": 0,
   "room": "f0-r5",
   "kind": "toilet",
   "position": [
    20.51,
    16.33
   ],
   "facingDeg": 270,
   "furniture": "f0-fur12"
  },
  {
   "id": "f0-a4",
   "floor": 0,
   "room": "f0-corridor",
   "kind": "patrol_point",
   "position": [
    9.75,
    10.25
   ],
   "facingDeg": 0
  },
  {
   "id": "f0-a5",
   "floor": 0,
   "room": "f0-corridor",
   "kind": "cleaning_spot",
   "position": [
    9.75,
    10.25
   ],
   "facingDeg": 180
  },
  {
   "id": "f0-a6",
   "floor": 0,
   "room": "f0-r0",
   "kind": "patrol_point",
   "position": [
    18.8,
    15.75
   ],
   "facingDeg": 0
  },
  {
   "id": "f0-a7",
   "floor": 0,
   "room": "f0-r0",
   "kind": "cleaning_spot",
   "position": [
    18.8,
    15.75
   ],
   "facingDeg": 180
  },
  {
   "id": "f0-a8",
   "floor": 0,
   "room": "f0-r3",
   "kind": "entrance",
   "position": [
    13,
    0.8
   ],
   "facingDeg": 0
  },
  {
   "id": "f0-a9",
   "floor": 0,
   "room": "f0-r3",
   "kind": "idle_spot",
   "position": [
    13,
    4.5
   ],
   "facingDeg": 0
  },
  {
   "id": "f0-a10",
   "floor": 0,
   "room": "f0-r3",
   "kind": "patrol_point",
   "position": [
    1.5,
    1.5
   ],
   "facingDeg": 45
  },
  {
   "id": "f0-c0",
   "floor": 0,
   "room": "f0-corridor",
   "kind": "elevator_wait",
   "position": [
    10.75,
    10.7
   ],
   "facingDeg": 0
  },
  {
   "id": "f0-c1",
   "floor": 0,
   "room": "f0-corridor",
   "kind": "elevator_wait",
   "position": [
    13.25,
    10.7
   ],
   "facingDeg": 0
  },
  {
   "id": "f0-c2",
   "floor": 0,
   "room": "f0-corridor",
   "kind": "elevator_wait",
   "position": [
    15.75,
    10.7
   ],
   "facingDeg": 0
  },
  {
   "id": "f0-c3",
   "floor": 0,
   "room": "f0-corridor",
   "kind": "stair_entry",
   "position": [
    8.8,
    10.9
   ],
   "facingDeg": 0
  },
  {
   "id": "f0-c4",
   "floor": 0,
   "room": "f0-corridor",
   "kind": "stair_entry",
   "position": [
    18.9,
    10.25
   ],
   "facingDeg": 0
  },
  {
   "id": "f1-a0",
   "floor": 1,
   "room": "f1-r3",
   "kind": "counter_spot",
   "position": [
    14.56,
    8.49
   ],
   "facingDeg": 180,
   "furniture": "f1-fur4"
  },
  {
   "id": "f1-a1",
   "floor": 1,
   "room": "f1-r3",
   "kind": "seat",
   "position": [
    1.25,
    2.1
   ],
   "facingDeg": 180,
   "furniture": "f1-fur5"
  },
  {
   "id": "f1-a2",
   "floor": 1,
   "room": "f1-r3",
   "kind": "seat",
   "position": [
    3.55,
    2.1
   ],
   "facingDeg": 180,
   "furniture": "f1-fur6"
  },
  {
   "id": "f1-a3",
   "floor": 1,
   "room": "f1-r3",
   "kind": "seat",
   "position": [
    5.85,
    2.1
   ],
   "facingDeg": 180,
   "furniture": "f1-fur7"
  },
  {
   "id": "f1-a4",
   "floor": 1,
   "room": "f1-r3",
   "kind": "seat",
   "position": [
    8.15,
    2.1
   ],
   "facingDeg": 180,
   "furniture": "f1-fur8"
  },
  {
   "id": "f1-a5",
   "floor": 1,
   "room": "f1-r3",
   "kind": "seat",
   "position": [
    10.45,
    2.1
   ],
   "facingDeg": 180,
   "furniture": "f1-fur9"
  },
  {
   "id": "f1-a6",
   "floor": 1,
   "room": "f1-r3",
   "kind": "seat",
   "position": [
    12.75,
    2.1
   ],
   "facingDeg": 180,
   "furniture": "f1-fur10"
  },
  {
   "id": "f1-a7",
   "floor": 1,
   "room": "f1-r3",
   "kind": "seat",
   "position": [
    15.05,
    2.1
   ],
   "facingDeg": 180,
   "furniture": "f1-fur11"
  },
  {
   "id": "f1-a8",
   "floor": 1,
   "room": "f1-r3",
   "kind": "seat",
   "position": [
    17.35,
    2.1
   ],
   "facingDeg": 180,
   "furniture": "f1-fur12"
  },
  {
   "id": "f1-a9",
   "floor": 1,
   "room": "f1-r3",
   "kind": "seat",
   "position": [
    19.65,
    2.1
   ],
   "facingDeg": 180,
   "furniture": "f1-fur13"
  },
  {
   "id": "f1-a10",
   "floor": 1,
   "room": "f1-r3",
   "kind": "seat",
   "position": [
    21.95,
    2.1
   ],
   "facingDeg": 180,
   "furniture": "f1-fur14"
  },
  {
   "id": "f1-a11",
   "floor": 1,
   "room": "f1-r3",
   "kind": "seat",
   "position": [
    24.25,
    2.1
   ],
   "facingDeg": 180,
   "furniture": "f1-fur15"
  },
  {
   "id": "f1-a12",
   "floor": 1,
   "room": "f1-r3",
   "kind": "seat",
   "position": [
    1.25,
    4.4
   ],
   "facingDeg": 180,
   "furniture": "f1-fur16"
  },
  {
   "id": "f1-a13",
   "floor": 1,
   "room": "f1-r3",
   "kind": "seat",
   "position": [
    3.55,
    4.4
   ],
   "facingDeg": 180,
   "furniture": "f1-fur17"
  },
  {
   "id": "f1-a14",
   "floor": 1,
   "room": "f1-r3",
   "kind": "seat",
   "position": [
    5.85,
    4.4
   ],
   "facingDeg": 180,
   "furniture": "f1-fur18"
  },
  {
   "id": "f1-a15",
   "floor": 1,
   "room": "f1-r3",
   "kind": "seat",
   "position": [
    8.15,
    4.4
   ],
   "facingDeg": 180,
   "furniture": "f1-fur19"
  },
  {
   "id": "f1-a16",
   "floor": 1,
   "room": "f1-r3",
   "kind": "seat",
   "position": [
    10.45,
    4.4
   ],
   "facingDeg": 180,
   "furniture": "f1-fur20"
  },
  {
   "id": "f1-a17",
   "floor": 1,
   "room": "f1-r3",
   "kind": "seat",
   "position": [
    12.75,
    4.4
   ],
   "facingDeg": 180,
   "furniture": "f1-fur21"
  },
  {
   "id": "f1-a18",
   "floor": 1,
   "room": "f1-r3",
   "kind": "seat",
   "position": [
    15.05,
    4.4
   ],
   "facingDeg": 180,
   "furniture": "f1-fur22"
  },
  {
   "id": "f1-a19",
   "floor": 1,
   "room": "f1-r3",
   "kind": "seat",
   "position": [
    17.35,
    4.4
   ],
   "facingDeg": 180,
   "furniture": "f1-fur23"
  },
  {
   "id": "f1-a20",
   "floor": 1,
   "room": "f1-r3",
   "kind": "seat",
   "position": [
    19.65,
    4.4
   ],
   "facingDeg": 180,
   "furniture": "f1-fur24"
  },
  {
   "id": "f1-a21",
   "floor": 1,
   "room": "f1-r3",
   "kind": "seat",
   "position": [
    21.95,
    4.4
   ],
   "facingDeg": 180,
   "furniture": "f1-fur25"
  },
  {
   "id": "f1-a22",
   "floor": 1,
   "room": "f1-r3",
   "kind": "seat",
   "position": [
    24.25,
    4.4
   ],
   "facingDeg": 180,
   "furniture": "f1-fur26"
  },
  {
   "id": "f1-a23",
   "floor": 1,
   "room": "f1-r3",
   "kind": "seat",
   "position": [
    1.25,
    6.7
   ],
   "facingDeg": 180,
   "furniture": "f1-fur27"
  },
  {
   "id": "f1-a24",
   "floor": 1,
   "room": "f1-r3",
   "kind": "seat",
   "position": [
    3.55,
    6.7
   ],
   "facingDeg": 180,
   "furniture": "f1-fur28"
  },
  {
   "id": "f1-a25",
   "floor": 1,
   "room": "f1-r3",
   "kind": "seat",
   "position": [
    5.85,
    6.7
   ],
   "facingDeg": 180,
   "furniture": "f1-fur29"
  },
  {
   "id": "f1-a26",
   "floor": 1,
   "room": "f1-r3",
   "kind": "seat",
   "position": [
    8.15,
    6.7
   ],
   "facingDeg": 180,
   "furniture": "f1-fur30"
  },
  {
   "id": "f1-a27",
   "floor": 1,
   "room": "f1-r4",
   "kind": "work_spot",
   "position": [
    1.43,
    18.89
   ],
   "facingDeg": 0,
   "furniture": "f1-fur31"
  },
  {
   "id": "f1-a28",
   "floor": 1,
   "room": "f1-r4",
   "kind": "counter_spot",
   "position": [
    0.51,
    14.14
   ],
   "facingDeg": 90,
   "furniture": "f1-fur34"
  },
  {
   "id": "f1-a29",
   "floor": 1,
   "room": "f1-r5",
   "kind": "toilet",
   "position": [
    20.33,
    18.89
   ],
   "facingDeg": 0,
   "furniture": "f1-fur36"
  },
  {
   "id": "f1-a30",
   "floor": 1,
   "room": "f1-r5",
   "kind": "toilet",
   "position": [
    20.51,
    15.32
   ],
   "facingDeg": 270,
   "furniture": "f1-fur37"
  },
  {
   "id": "f1-a31",
   "floor": 1,
   "room": "f1-corridor",
   "kind": "patrol_point",
   "position": [
    9.75,
    10.25
   ],
   "facingDeg": 0
  },
  {
   "id": "f1-a32",
   "floor": 1,
   "room": "f1-corridor",
   "kind": "cleaning_spot",
   "position": [
    9.75,
    10.25
   ],
   "facingDeg": 180
  },
  {
   "id": "f1-a33",
   "floor": 1,
   "room": "f1-r0",
   "kind": "patrol_point",
   "position": [
    18.8,
    15.75
   ],
   "facingDeg": 0
  },
  {
   "id": "f1-a34",
   "floor": 1,
   "room": "f1-r0",
   "kind": "cleaning_spot",
   "position": [
    18.8,
    15.75
   ],
   "facingDeg": 180
  },
  {
   "id": "f1-a35",
   "floor": 1,
   "room": "f1-r3",
   "kind": "idle_spot",
   "position": [
    13,
    4.5
   ],
   "facingDeg": 0
  },
  {
   "id": "f1-c0",
   "floor": 1,
   "room": "f1-corridor",
   "kind": "elevator_wait",
   "position": [
    10.75,
    10.7
   ],
   "facingDeg": 0
  },
  {
   "id": "f1-c1",
   "floor": 1,
   "room": "f1-corridor",
   "kind": "elevator_wait",
   "position": [
    13.25,
    10.7
   ],
   "facingDeg": 0
  },
  {
   "id": "f1-c2",
   "floor": 1,
   "room": "f1-corridor",
   "kind": "elevator_wait",
   "position": [
    15.75,
    10.7
   ],
   "facingDeg": 0
  },
  {
   "id": "f1-c3",
   "floor": 1,
   "room": "f1-corridor",
   "kind": "stair_entry",
   "position": [
    8.8,
    10.9
   ],
   "facingDeg": 0
  },
  {
   "id": "f1-c4",
   "floor": 1,
   "room": "f1-corridor",
   "kind": "stair_entry",
   "position": [
    18.9,
    10.25
   ],
   "facingDeg": 0
  },
  {
   "id": "f2-a0",
   "floor": 2,
   "room": "f2-r2",
   "kind": "toilet",
   "position": [
    17.41,
    18.89
   ],
   "facingDeg": 0,
   "furniture": "f2-fur0"
  },
  {
   "id": "f2-a1",
   "floor": 2,
   "room": "f2-r2",
   "kind": "toilet",
   "position": [
    10.93,
    18.89
   ],
   "facingDeg": 0,
   "furniture": "f2-fur1"
  },
  {
   "id": "f2-a2",
   "floor": 2,
   "room": "f2-r3",
   "kind": "work_spot",
   "position": [
    1.74,
    7.74
   ],
   "facingDeg": 0,
   "furniture": "f2-fur5"
  },
  {
   "id": "f2-a3",